publishedAt,title,description,source,url,text
2025-06-23 13:00:00+00:00,I Saw Google’s New ChromeOS AI Tool in Action—and It's Pretty Amazing,"The Capture Text tool for Chromebook Plus computers uses AI to analyze anything you select on your screen and suggest relevant actions, all without interrupting your workflow.
Google isn't giving up any ground to Apple or Microsoft in the race to add AI featu…","{'id': None, 'name': 'PCMag.com'}",https://me.pcmag.com/en/ai/30553/i-saw-googles-new-chromeos-ai-tool-in-action-and-its-pretty-amazing,"i saw google’s new chromeos ai tool in action—and it's pretty amazing the capture text tool for chromebook plus computers uses ai to analyze anything you select on your screen and suggest relevant actions, all without interrupting your workflow.
google isn't giving up any ground to apple or microsoft in the race to add ai featu…"
2025-06-23 13:00:00+00:00,I Saw Google’s New ChromeOS AI Tool in Action—and It's Pretty Amazing,"The Capture Text tool for Chromebook Plus computers uses AI to analyze anything you select on your screen and suggest relevant actions, all without interrupting your workflow.
Google isn't giving up any ground to Apple or Microsoft in the race to add AI featu…","{'id': None, 'name': 'PCMag.com'}",https://uk.pcmag.com/ai/158708/i-saw-googles-new-chromeos-ai-tool-in-action-and-its-pretty-amazing,"i saw google’s new chromeos ai tool in action—and it's pretty amazing the capture text tool for chromebook plus computers uses ai to analyze anything you select on your screen and suggest relevant actions, all without interrupting your workflow.
google isn't giving up any ground to apple or microsoft in the race to add ai featu…"
2025-06-23 12:55:48+00:00,Microsoft Edge won't open,"Microsoft Edge won't open - posted in Windows 10 Support: Hi,
 
Sorry Im new here so please forgive me if I do something wrong.
 
Trying to get some help as Edge wont open.
 
Ive already read in this forum about MS Edge wont start post, but in my case I didnt…","{'id': None, 'name': 'BleepingComputer'}",https://www.bleepingcomputer.com/forums/t/809146/microsoft-edge-wont-open/,"microsoft edge won't open microsoft edge won't open - posted in windows 10 support: hi,
 
sorry im new here so please forgive me if i do something wrong.
 
trying to get some help as edge wont open.
 
ive already read in this forum about ms edge wont start post, but in my case i didnt…"
2025-06-23 12:45:01+00:00,"OneDrive user locked out of ""30 years worth of photos and work"" without any support — calls Microsoft a ""Kafkaesque black hole""","A OneDrive user took to Reddit to express their frustrations about Microsoft ""randomly"" locking their account without any substantial reason or warning.","{'id': None, 'name': 'Windows Central'}",https://www.windowscentral.com/software-apps/onedrive-user-locked-out-of-30-years-worth-of-photos,"onedrive user locked out of ""30 years worth of photos and work"" without any support — calls microsoft a ""kafkaesque black hole"" a onedrive user took to reddit to express their frustrations about microsoft ""randomly"" locking their account without any substantial reason or warning."
2025-06-23 12:44:56+00:00,Amazon slashes a whopping $300 off the 16/512GB Microsoft Surface Pro 11 with LCD display,"The tablet offers speedy performance, while its display delivers a pleasant viewing experience. It's great for both work and entertainment. Save while you can!","{'id': None, 'name': 'PhoneArena'}",https://www.phonearena.com/news/microsoft-surface-pro-11-300-off-amazon_id171597,"amazon slashes a whopping $300 off the 16/512gb microsoft surface pro 11 with lcd display the tablet offers speedy performance, while its display delivers a pleasant viewing experience. it's great for both work and entertainment. save while you can!"
2025-06-23 12:24:08+00:00,10 Reasons to Buy and Hold This Tech Stock Forever,"In This Article:
Key Points
-
Microsoft has one of the most diversified businesses in all of the tech world.
-
Its corporate clients provide reliable revenue and high customer retention.
-
The company has navigated some of the country's toughest economic time…","{'id': None, 'name': 'Biztoc.com'}",https://biztoc.com/x/69ee986062bac3b5,"10 reasons to buy and hold this tech stock forever in this article:
key points
-
microsoft has one of the most diversified businesses in all of the tech world.
-
its corporate clients provide reliable revenue and high customer retention.
-
the company has navigated some of the country's toughest economic time…"
2025-06-23 12:06:23+00:00,Xbox Game Pass Users Call New Day One Games “Addicting” and “Amazing”,"Xbox Game Pass Ultimate subscribers on PC and Xbox Series X recently received three day one games. Unfortunately, one of the day one Xbox Game Pass games has proven to be one of the year’s biggest flops. However, the other two are fortunately not flops. In fa…","{'id': None, 'name': 'ComicBook.com'}",http://comicbook.com/gaming/news/xbox-game-pass-ultimate-pc-day-one-games-rematch-lost-in-random/,"xbox game pass users call new day one games “addicting” and “amazing” xbox game pass ultimate subscribers on pc and xbox series x recently received three day one games. unfortunately, one of the day one xbox game pass games has proven to be one of the year’s biggest flops. however, the other two are fortunately not flops. in fa…"
2025-06-23 12:00:00+00:00,Rezolve Ai to Join Russell 2000® and Russell 3000® Indices Following Breakout Year of Hypergrowth and Strategic Alliances,"$70 Million ARR Locked in via Customer ContractsMicrosoft and Google Partnerships Accelerate Momentum  NEW YORK, June  23, 2025  (GLOBE NEWSWIRE) --......","{'id': None, 'name': 'GlobeNewswire'}",https://www.globenewswire.com/news-release/2025/06/23/3103310/0/en/Rezolve-Ai-to-Join-Russell-2000-and-Russell-3000-Indices-Following-Breakout-Year-of-Hypergrowth-and-Strategic-Alliances.html,"rezolve ai to join russell 2000® and russell 3000® indices following breakout year of hypergrowth and strategic alliances $70 million arr locked in via customer contractsmicrosoft and google partnerships accelerate momentum  new york, june  23, 2025  (globe newswire) --......"
2025-06-23 11:53:48+00:00,"Linus Torvalds has apparently met Bill Gates for the first time in person and before you ask, no he didn't clock him in the face","It's a far cry from the days when Linux was ""a cancer"" in the eyes of Microsoft.","{'id': None, 'name': 'PC Gamer'}",https://www.pcgamer.com/software/operating-systems/linus-torvalds-has-apparently-met-bill-gates-for-the-first-time-in-person-and-before-you-ask-no-he-didnt-clock-him-in-the-face/,"linus torvalds has apparently met bill gates for the first time in person and before you ask, no he didn't clock him in the face it's a far cry from the days when linux was ""a cancer"" in the eyes of microsoft."
