publishedAt,title,description,source,url,text
2025-06-23 16:37:54+00:00,Microsoft begins turning everything you own into an Xbox with a new aggregated library,"As console and game prices spike, Microsoft wants to turn your gadgets into Xboxes.","{'id': None, 'name': 'XDA Developers'}",https://www.xda-developers.com/microsoft-xbox-aggregated-library/,"microsoft begins turning everything you own into an xbox with a new aggregated library as console and game prices spike, microsoft wants to turn your gadgets into xboxes."
2025-06-23 16:35:21+00:00,"Xbox-themed Quest 3S has been spotted ready for release and if you close your eyes and imagine what an Xbox-themed Quest 3S looks like, bingo",Anything really can be an Xbox.,"{'id': None, 'name': 'PC Gamer'}",https://www.pcgamer.com/games/vr/xbox-themed-quest-3s-has-been-spotted-ready-for-release-and-if-you-close-your-eyes-and-imagine-what-an-xbox-themed-quest-3s-looks-like-bingo/,"xbox-themed quest 3s has been spotted ready for release and if you close your eyes and imagine what an xbox-themed quest 3s looks like, bingo anything really can be an xbox."
2025-06-23 16:32:54+00:00,Whoa! Microsoft adds Steam games to Windows 11’s Xbox beta app,"This is an Xbox. If you’re reading these words on any kind of web-connected screen, especially if it’s a Windows PC, Microsoft wants you to think that. To double down on its everything, everywhere, all at once strategy, and in advance of that new Asus ROG Xbo…","{'id': None, 'name': 'PCWorld'}",https://www.pcworld.com/article/2824662/whoa-microsoft-adds-steam-games-to-windows-11s-xbox-beta-app.html,"whoa! microsoft adds steam games to windows 11’s xbox beta app this is an xbox. if you’re reading these words on any kind of web-connected screen, especially if it’s a windows pc, microsoft wants you to think that. to double down on its everything, everywhere, all at once strategy, and in advance of that new asus rog xbo…"
2025-06-23 16:30:00+00:00,IYO Sues OpenAI Over IO,"IYO filed a trademark infringement lawsuit [PDF] against OpenAI and Jony Ive's company earlier this month, alleging the defendants deliberately adopted a confusingly similar name for competing products. The lawsuit surfaced after the Microsoft-backed startup …","{'id': None, 'name': 'Slashdot.org'}",https://yro.slashdot.org/story/25/06/23/1630236/iyo-sues-openai-over-io,"iyo sues openai over io iyo filed a trademark infringement lawsuit [pdf] against openai and jony ive's company earlier this month, alleging the defendants deliberately adopted a confusingly similar name for competing products. the lawsuit surfaced after the microsoft-backed startup …"
2025-06-23 16:23:19+00:00,Xbox June Updates Adds More Ways to Customize the Home Screen,"The Xbox June Update makes it possible to hide system apps, pin favorites, and reduce the number of tiles in the recently played list on the Home Screen. 
The post Xbox June Updates Adds More Ways to Customize the Home Screen appeared first on Thurrott.com.","{'id': None, 'name': 'Thurrott.com'}",https://www.thurrott.com/games/322444/xbox-june-updates-adds-more-ways-to-customize-the-home-screen,"xbox june updates adds more ways to customize the home screen the xbox june update makes it possible to hide system apps, pin favorites, and reduce the number of tiles in the recently played list on the home screen. 
the post xbox june updates adds more ways to customize the home screen appeared first on thurrott.com."
2025-06-23 16:18:44+00:00,Microsoft Adds Steam Library to Xbox PC App on Windows,"Microsoft is letting Xbox Insiders try out a new library in the Xbox PC app on Windows that brings together games from Steam, Battle.net, Xbox, and Game Pass in one central spot. Once you install a supported title, it automatically shows up in your library an…","{'id': None, 'name': 'Techpowerup.com'}",https://www.techpowerup.com/338270/microsoft-adds-steam-library-to-xbox-pc-app-on-windows,"microsoft adds steam library to xbox pc app on windows microsoft is letting xbox insiders try out a new library in the xbox pc app on windows that brings together games from steam, battle.net, xbox, and game pass in one central spot. once you install a supported title, it automatically shows up in your library an…"
2025-06-23 16:16:45+00:00,Microsoft Scientist: Lack of AI Regulation in US Will “Hold Us Back”,"Deregulating tech may not be as helpful as the Trump administration thinks, with a Microsoft scientist stating that the recent move to ban US states from regulating AI technology could “hold us back” in the long run.
The race for AI supremacy has been a stres…","{'id': None, 'name': 'Biztoc.com'}",https://biztoc.com/x/03f783ef76c8accc,"microsoft scientist: lack of ai regulation in us will “hold us back” deregulating tech may not be as helpful as the trump administration thinks, with a microsoft scientist stating that the recent move to ban us states from regulating ai technology could “hold us back” in the long run.
the race for ai supremacy has been a stres…"
2025-06-23 16:12:16+00:00,Microsoft Is Ditching Passwords for Passkeys: How to Switch Before the August Deadline,Nearly half of US adults have risky password habits. Microsoft's new approach could change that.,"{'id': None, 'name': 'Slashdot.org'}",https://slashdot.org/firehose.pl?op=view&amp;id=178151515,microsoft is ditching passwords for passkeys: how to switch before the august deadline nearly half of us adults have risky password habits. microsoft's new approach could change that.
2025-06-23 16:06:00+00:00,Xbox PC App Is Aggregating Your Game Library From Other Stores,"Xbox's June update is here, and a new feature for Insiders on the Xbox PC app allows them to have one ""aggregated game library"" through the Xbox app.What that means is that the Xbox PC app can now look at other storefronts and launchers that players have game…","{'id': None, 'name': 'GameSpot'}",https://www.gamespot.com/articles/xbox-pc-app-is-aggregating-your-game-library-from-other-stores/1100-6532634/,"xbox pc app is aggregating your game library from other stores xbox's june update is here, and a new feature for insiders on the xbox pc app allows them to have one ""aggregated game library"" through the xbox app.what that means is that the xbox pc app can now look at other storefronts and launchers that players have game…"
2025-06-23 16:00:22+00:00,Introducing Mu language model and how it enabled the agent in Windows Settings,"We are excited to introduce our newest on-device small language model, Mu. This model addresses scenarios that require inferring complex input-output relationships and has been designed to operate efficiently, delivering high performance while runnin
The post…","{'id': None, 'name': 'Windows.com'}",https://blogs.windows.com/windowsexperience/2025/06/23/introducing-mu-language-model-and-how-it-enabled-the-agent-in-windows-settings/,"introducing mu language model and how it enabled the agent in windows settings we are excited to introduce our newest on-device small language model, mu. this model addresses scenarios that require inferring complex input-output relationships and has been designed to operate efficiently, delivering high performance while runnin
the post…"
2025-06-23 16:00:00+00:00,Navigating cyber risks with Microsoft Security Exposure Management eBook,"Microsoft Security Exposure Management's eBook helps educate teams on how to anticipate threats across hybrid environments, transforming risk into resilience.
The post Navigating cyber risks with Microsoft Security Exposure Management eBook appeared first on …","{'id': None, 'name': 'Microsoft.com'}",https://www.microsoft.com/en-us/security/blog/2025/06/23/navigating-cyber-risks-with-microsoft-security-exposure-management-ebook/,"navigating cyber risks with microsoft security exposure management ebook microsoft security exposure management's ebook helps educate teams on how to anticipate threats across hybrid environments, transforming risk into resilience.
the post navigating cyber risks with microsoft security exposure management ebook appeared first on …"
2025-06-23 15:53:31+00:00,Microsoft is officially making the Xbox app on PC a universal launcher,"Following leaks, Microsoft has officially kicked off testing for the Xbox app to become a universal launcher. Here's how to get access. Read more...","{'id': None, 'name': 'Neowin'}",https://www.neowin.net/news/microsoft-is-officially-making-the-xbox-app-on-pc-a-universal-launcher/,"microsoft is officially making the xbox app on pc a universal launcher following leaks, microsoft has officially kicked off testing for the xbox app to become a universal launcher. here's how to get access. read more..."
2025-06-23 15:42:37+00:00,Xbox App For PC Adds Aggregated Gaming Library in Preview,"Microsoft is testing the integration of games installed from other digital storefronts, such as Steam, into its Xbox app for PC.
The post Xbox App For PC Adds Aggregated Gaming Library in Preview appeared first on Thurrott.com.","{'id': None, 'name': 'Thurrott.com'}",https://www.thurrott.com/games/322439/xbox-app-for-pc-adds-aggregated-gaming-library-in-preview,"xbox app for pc adds aggregated gaming library in preview microsoft is testing the integration of games installed from other digital storefronts, such as steam, into its xbox app for pc.
the post xbox app for pc adds aggregated gaming library in preview appeared first on thurrott.com."
2025-06-23 15:34:57+00:00,Windows 11’s crucial Restore Points now self-destruct after 60 days,"Windows 11 users will need to keep a close eye on their operating system’s restore points if they want to be able to recover their PC after a major outage, Windows Latest reports.




With the June update, Windows 11 24H2, Microsoft announced that restore po…","{'id': None, 'name': 'PCWorld'}",https://www.pcworld.com/article/2824671/windows-11s-crucial-restore-points-now-self-destruct-after-60-days.html,"windows 11’s crucial restore points now self-destruct after 60 days windows 11 users will need to keep a close eye on their operating system’s restore points if they want to be able to recover their pc after a major outage, windows latest reports.




with the june update, windows 11 24h2, microsoft announced that restore po…"
2025-06-23 15:33:16+00:00,Parallels Desktop 20 Pro Edition for Mac: 1-Year Subscription for $75,"That's $3 less than you'd pay elsewhere for this subscription — it lets you run Windows 11 on Mac computers, supporting more than 200,000 Windows apps and games side-by-side with macOS applications. Buy Now at StackSocial","{'id': None, 'name': 'Dealnews.com'}",https://www.dealnews.com/Parallels-Desktop-20-Pro-Edition-for-Mac-1-Year-Subscription-for-75/21746087.html,"parallels desktop 20 pro edition for mac: 1-year subscription for $75 that's $3 less than you'd pay elsewhere for this subscription — it lets you run windows 11 on mac computers, supporting more than 200,000 windows apps and games side-by-side with macos applications. buy now at stacksocial"
2025-06-23 15:22:00+00:00,Bill Gates finally meets Linus Torvalds at dinner of tech titans,"Microsoft chief technical officer Mark Russinovich posted evidence of the historic dinner in a LinkedIn post. Dave Cutler, the legendary programmer and lead architect of the Windows NT kernel, was also present, completing this meeting of tech titans.Read Enti…","{'id': None, 'name': 'TechSpot'}",https://www.techspot.com/news/108415-bill-gates-finally-meets-linus-torvalds-dinner-tech.html,"bill gates finally meets linus torvalds at dinner of tech titans microsoft chief technical officer mark russinovich posted evidence of the historic dinner in a linkedin post. dave cutler, the legendary programmer and lead architect of the windows nt kernel, was also present, completing this meeting of tech titans.read enti…"
2025-06-23 15:16:12+00:00,Doom: The Dark Ages Limited Edition Xbox Controller Has Dropped to Just £58 at Amazon UK,"Get the DOOM: The Dark Ages Xbox Controller for just £58.49 on Amazon UK, at 22% off RRP while stocks last, compatible with Xbox & PC.","{'id': 'ign', 'name': 'IGN'}",https://www.ign.com/articles/doom-the-dark-ages-limited-edition-xbox-controller-deal-uk,"doom: the dark ages limited edition xbox controller has dropped to just £58 at amazon uk get the doom: the dark ages xbox controller for just £58.49 on amazon uk, at 22% off rrp while stocks last, compatible with xbox & pc."
2025-06-23 15:10:15+00:00,Industry Comparison: Evaluating Microsoft Against Competitors In Software Industry,"In the fast-paced and highly competitive business world of today, conducting thorough company analysis is essential for investors and industry observers. In this article, we will conduct an extensive industry comparison, evaluating Microsoft MSFT in relation …","{'id': None, 'name': 'Biztoc.com'}",https://biztoc.com/x/e1390c230dc35645,"industry comparison: evaluating microsoft against competitors in software industry in the fast-paced and highly competitive business world of today, conducting thorough company analysis is essential for investors and industry observers. in this article, we will conduct an extensive industry comparison, evaluating microsoft msft in relation …"
2025-06-23 15:03:07+00:00,Microsoft adds Steam games to its Xbox PC app on Windows,Microsoft is starting to test its new aggregated gaming library in its Xbox PC app on Windows. Xbox Insiders will now be able to see their Steam and Battle.net games all within the Xbox app — making it a single launcher for most installed PC games. This new c…,"{'id': 'the-verge', 'name': 'The Verge'}",https://www.theverge.com/news/690967/microsoft-xbox-app-windows-steam-games-aggregated-library-support-beta,microsoft adds steam games to its xbox pc app on windows microsoft is starting to test its new aggregated gaming library in its xbox pc app on windows. xbox insiders will now be able to see their steam and battle.net games all within the xbox app — making it a single launcher for most installed pc games. this new c…
2025-06-23 15:01:00+00:00,"Image Recognition Market Forecast Report 2025-2030, with Profiles of Notable Players Qualcomm, Microsoft, IBM, Google, NVIDIA, AWS, Catchoom Technologies, Hitachi, Slyce, Wikitude, and Clarifai","The Image Recognition Market is forecasted to grow to US$98.183 billion by 2030 from US$53.550 billion in 2025, at a CAGR of 12.89%. Driven by advances in communication, technology, and consumer electronics, the market sees major players such as Google, NVIDI…","{'id': None, 'name': 'GlobeNewswire'}",https://www.globenewswire.com/news-release/2025/06/23/3103610/28124/en/Image-Recognition-Market-Forecast-Report-2025-2030-with-Profiles-of-Notable-Players-Qualcomm-Microsoft-IBM-Google-NVIDIA-AWS-Catchoom-Technologies-Hitachi-Slyce-Wikitude-and-Clarif.html,"image recognition market forecast report 2025-2030, with profiles of notable players qualcomm, microsoft, ibm, google, nvidia, aws, catchoom technologies, hitachi, slyce, wikitude, and clarifai the image recognition market is forecasted to grow to us$98.183 billion by 2030 from us$53.550 billion in 2025, at a cagr of 12.89%. driven by advances in communication, technology, and consumer electronics, the market sees major players such as google, nvidi…"
2025-06-23 15:00:48+00:00,"I use this stylish retro mini PC as a living room indie games portal, and it's effectively a tiny Xbox that rivals handhelds","The Ayaneo AM02 is a mini PC that looks like a futuristic NES, performs like a high-end handheld, and can act like a tiny Xbox using Windows 11.","{'id': None, 'name': 'GamesRadar+'}",https://www.gamesradar.com/hardware/desktop-pc/i-use-this-stylish-retro-mini-pc-as-a-living-room-indie-games-portal-and-its-effectively-a-tiny-xbox-that-rivals-handhelds/,"i use this stylish retro mini pc as a living room indie games portal, and it's effectively a tiny xbox that rivals handhelds the ayaneo am02 is a mini pc that looks like a futuristic nes, performs like a high-end handheld, and can act like a tiny xbox using windows 11."
2025-06-23 15:00:00+00:00,Microsoft Is Ditching Passwords for Passkeys: How to Switch Before the August Deadline,Nearly half of US adults have risky password habits. Microsoft's new approach could change that.,"{'id': None, 'name': 'CNET'}",https://www.cnet.com/tech/microsoft-is-ditching-passwords-for-passkeys-how-to-make-the-switch-before-the-august-deadline/,microsoft is ditching passwords for passkeys: how to switch before the august deadline nearly half of us adults have risky password habits. microsoft's new approach could change that.
2025-06-23 15:00:00+00:00,"Starting this week, the Xbox PC app will integrate 'leading PC gaming stores' for Xbox Insiders — with no mention of Steam","Although the blog post doesn't say which PC stores are going to be integrated, at the very least, you'll be able to access Battle.net games directly from the Xbox PC app from next week.","{'id': None, 'name': 'Windows Central'}",https://www.windowscentral.com/gaming/pc-gaming/starting-this-week-the-xbox-pc-app-will-start-integrating-pc-stores,"starting this week, the xbox pc app will integrate 'leading pc gaming stores' for xbox insiders — with no mention of steam although the blog post doesn't say which pc stores are going to be integrated, at the very least, you'll be able to access battle.net games directly from the xbox pc app from next week."
2025-06-23 14:46:23+00:00,macOS 15.5 Mail app and Google Mail aren't getting along for some users,"Some macOS 15.5 Mail users are dealing with authentication issues when using the app with Microsoft or Google accounts. It's not yet clear why.Apple Mail iconIssues with Apple Software are an occasional problem for users, but sometimes the reason for their ex…","{'id': None, 'name': 'AppleInsider'}",https://appleinsider.com/articles/25/06/23/macos-155-mail-app-and-google-mail-arent-getting-along-for-some-users,"macos 15.5 mail app and google mail aren't getting along for some users some macos 15.5 mail users are dealing with authentication issues when using the app with microsoft or google accounts. it's not yet clear why.apple mail iconissues with apple software are an occasional problem for users, but sometimes the reason for their ex…"
2025-06-23 14:39:40+00:00,Microsoft will start removing legacy drivers from Windows Update,"Microsoft will start removing legacy drivers from Windows Update to improve driver quality for Windows users but, most importantly, to increase security, the company has announced. This is intended to be an ongoing process and Microsoft is planning to introdu…","{'id': None, 'name': 'Help Net Security'}",https://www.helpnetsecurity.com/2025/06/23/microsoft-will-start-removing-legacy-drivers-from-windows-update/,"microsoft will start removing legacy drivers from windows update microsoft will start removing legacy drivers from windows update to improve driver quality for windows users but, most importantly, to increase security, the company has announced. this is intended to be an ongoing process and microsoft is planning to introdu…"
2025-06-23 14:28:00+00:00,Microsoft says “Responsible AI” is now its biggest priority - but what does this look like?,New Transparency Report reveals Microsoft's plans for building trustworthy models,"{'id': 'techradar', 'name': 'TechRadar'}",https://www.techradar.com/pro/security/microsoft-says-responsible-ai-is-now-its-biggest-priority-but-what-does-this-look-like,microsoft says “responsible ai” is now its biggest priority - but what does this look like? new transparency report reveals microsoft's plans for building trustworthy models
2025-06-23 14:22:02+00:00,Xbox Confirms It Will Be At Gamescom 2025,"Xbox has confirmed through a post on X that it will be attending Gamescom 2025, which likely means another showcase from the company sometime between August 20 and 24. Bethesda and the World of Warcraft team at Blizzard will also be attending the event. We've…","{'id': None, 'name': 'Wccftech'}",https://wccftech.com/xbox-confirms-it-will-be-at-gamescom-2025/,"xbox confirms it will be at gamescom 2025 xbox has confirmed through a post on x that it will be attending gamescom 2025, which likely means another showcase from the company sometime between august 20 and 24. bethesda and the world of warcraft team at blizzard will also be attending the event. we've…"
2025-06-23 14:18:59+00:00,Bill Gates and Linux creator Linus Torvalds just met for the first time,"Microsoft co-founder Bill Gates and Linux creator Linus Torvalds have met for the first time ever. The Verge notes that it all happened at a dinner organised by Microsoft Azure CTO Mark Russinovich.




“No major kernel decisions were made, but maybe next di…","{'id': None, 'name': 'PCWorld'}",https://www.pcworld.com/article/2824493/bill-gates-and-linux-creator-linus-torvalds-just-met-for-the-first-time.html,"bill gates and linux creator linus torvalds just met for the first time microsoft co-founder bill gates and linux creator linus torvalds have met for the first time ever. the verge notes that it all happened at a dinner organised by microsoft azure cto mark russinovich.




“no major kernel decisions were made, but maybe next di…"
2025-06-23 14:16:01+00:00,Zoom Workplace 6.5.1.6476,"Zoom Workplace for Windows is a powerful collaboration tool that boosts productivity with seamless video conferencing, messaging, file sharing, strong security, app integrations, and an intuitive UI. Read more...","{'id': None, 'name': 'Neowin'}",https://www.neowin.net/software/zoom-workplace-6516476/,"zoom workplace 6.5.1.6476 zoom workplace for windows is a powerful collaboration tool that boosts productivity with seamless video conferencing, messaging, file sharing, strong security, app integrations, and an intuitive ui. read more..."
2025-06-23 14:01:11+00:00,Your jump from Windows 10 to Linux gets easier with KDE Plasma 6.4,Plasma 6.4 also introduces more inclusive features.,"{'id': None, 'name': 'ZDNet'}",https://www.zdnet.com/article/your-jump-from-windows-10-to-linux-gets-easier-with-kde-plasma-6-4/,your jump from windows 10 to linux gets easier with kde plasma 6.4 plasma 6.4 also introduces more inclusive features.
2025-06-23 13:30:00+00:00,How to turn off AI in Windows and bring yourself some peace,"You don't have to accept what Microsoft gives you.
The post How to turn off AI in Windows and bring yourself some peace appeared first on Popular Science.","{'id': None, 'name': 'Popular Science'}",https://www.popsci.com/diy/how-to-turn-off-ai-windows/,"how to turn off ai in windows and bring yourself some peace you don't have to accept what microsoft gives you.
the post how to turn off ai in windows and bring yourself some peace appeared first on popular science."
2025-06-23 13:12:00+00:00,XDigo Malware Exploits Windows LNK Flaw in Eastern European Government Attacks,"Cybersecurity researchers have uncovered a Go-based malware called XDigo that has been used in attacks targeting Eastern European governmental entities in March 2025.
The attack chains are said to have leveraged a collection of Windows shortcut (LNK) files as…","{'id': None, 'name': 'Internet'}",https://thehackernews.com/2025/06/xdigo-malware-exploits-windows-lnk-flaw.html,"xdigo malware exploits windows lnk flaw in eastern european government attacks cybersecurity researchers have uncovered a go-based malware called xdigo that has been used in attacks targeting eastern european governmental entities in march 2025.
the attack chains are said to have leveraged a collection of windows shortcut (lnk) files as…"
2025-06-23 13:10:00+00:00,"Xbox-Branded Quest 3S Looks Ready To Launch, Is This Microsoft's Next Big Play?","If you ask Microsoft, the Redmond outfit will tell you that practically everything is an Xbox. Not literally, mind you, but the company's 'This is an Xbox' campaign attempts to hammer home the idea that a wide assortment of hardware can be used to access its …","{'id': None, 'name': 'Hot Hardware'}",https://hothardware.com/news/xbox-branded-quest-3s-looks-ready-launch-microsofts-big-play,"xbox-branded quest 3s looks ready to launch, is this microsoft's next big play? if you ask microsoft, the redmond outfit will tell you that practically everything is an xbox. not literally, mind you, but the company's 'this is an xbox' campaign attempts to hammer home the idea that a wide assortment of hardware can be used to access its …"
2025-06-23 13:00:00+00:00,How to switch from Windows 10 to Linux: A technical guide,"There are gentle migration strategies that can delay the move away from Windows 10, which Microsoft will stop supporting in October 2025. Technically (and maybe even psychologically), the easiest step is the hard one: get rid of Windows 10 and install an attr…","{'id': None, 'name': 'PCWorld'}",https://www.pcworld.com/article/2800286/how-to-switch-from-windows-10-to-linux-a-technical-guide.html,"how to switch from windows 10 to linux: a technical guide there are gentle migration strategies that can delay the move away from windows 10, which microsoft will stop supporting in october 2025. technically (and maybe even psychologically), the easiest step is the hard one: get rid of windows 10 and install an attr…"
